27,Shapefile of Rivers,Dataset,Boundaries of Water Resources Projects,Central,"Department of Water Resources, River Development & Ganga Rejuvenation;Ministry of Jal Shakti;National Water Informatics Centre",28/9/2022,28/9/2022,16/9/2022,Ground Water;Surface Water;Ground Water;Surface Water,0.0,https://data.gov.in/files/ogdpv2dms/s3fs-public/dataurl15092022/Rivers.zip,application/zip,,One-time,One-time,1,National Water Informatics Centre,"This zip contains the various formats i.e .shp, .shx,.dbf,.prj,.sbn, .cpg,.dbf. This zip contains the information of all all the major and minor rivers  of entire country. It is a line .",/resource/shapefile-rivers,data.gov.in,2,0,,,True,0,,2410,2637
28,Rainfall in all India and its departure from normal during Monsoon session (June-Sept) from 1901 to 2019,Dataset,Rainfall in India,Central,"Ministry of Earth Sciences;India Meteorological Department (IMD);India Meteorological Department (IMD), Pune",20/5/2021,20/5/2021,2/11/2020,Science and Technology;Atmospheric Science;Earth Sciences;Earth Sciences;Earth Sciences;Earth Sciences;Earth Sciences,https://data.gov.in/files/ogd20/ogdpv2dms/s3fs-public/datafile/All-India-Rainfall-Act_Dep_1901_to_2019_0.csv;0.0,,text/csv,4192.0,Annual,Annual,0,"India Meteorological Department (IMD), Pune",Actual Rainfall in MM.,/resource/rainfall-all-india-and-its-departure-normal-during-monsoon-session-june-sept-1901-2019,data.gov.in,1,1,1.0,,True,0,,2044,2631
29,Enrolment by Age and Class (UDISE plus) during 2012-13,Dataset,Enrolment by Age and Class (UDISE plus),Central,Ministry of Education;Department of School Education and Literacy,14/9/2023,14/9/2023,13/1/2022,Education,https://data.gov.in/files/ogd20/ogdpv2dms/s3fs-public/datafile/enrolment_age_2012_13.csv?VersionId=105166644224513;0.0,,text/csv,1372069.0,Annual,Annual,0,Department of School Education and Literacy,,/resource/enrolment-age-and-class-udise-plus-during-2012-13,data.gov.in,1,0,0.0,0.0,True,0,,2005,1216
30,District wise Services MSME Registered Enterprises under UDYAM Registration till last date ,Dataset, UDYAM Registration (MSME Registration),Central,"Ministry of Micro, Small and Medium Enterprises",1/11/2021,27/6/2025,26/10/2021,Industries;Medium;Micro;Small Scale;Medium;Micro;Small Scale;Medium;Micro;Small Scale;Medium;Micro;Small Scale;Medium;Micro;Small Scale;Medium;Micro;Small Scale,https://data.gov.in/files/ogd20/ogdpv2dms/s3fs-public/datafile/district_level_service_msme.csv?VersionId=105172390466305;1.0,https://api.data.gov.in/resource/c3dfe7e6-0cfd-4ddb-8f79-9cb3695d9866?api-key=579b464db66ec23bdd000001cdc3b564546246a772a26393094f5645&offset=0&limit=all&format=csv,text/csv,37790.0,Daily,Daily,1,"Ministry of Micro, Small and Medium Enterprises",,/resource/district-wise-services-msme-registered-enterprises-under-udyam-registration-till-last-date,data.gov.in,4,1,1.0,11.0,True,1,7159069.0,1960,1349
31,Seasonal and Annual Min/Max Temp Series - India from 1901 to 2017,Dataset,All India Seasonal and Annual Min/Max Temperature Series,Central,"Ministry of Earth Sciences;India Meteorological Department (IMD);India Meteorological Department (IMD), Pune",18/12/2018,12/12/2021,4/12/2018,Science and Technology;Atmospheric Science;Earth Sciences;Earth Sciences;Earth Sciences;Earth Sciences;Earth Sciences,https://data.gov.in/files/ogdpv2dms/s3fs-public/datafile/Min_Max_Seasonal_IMD_2017.csv;0.0,,text/csv,7866.0,Annual,Annual,0,"India Meteorological Department (IMD), Pune","Data values are in degree Celsius.
",/resource/seasonal-and-annual-minmax-temp-series-india-1901-2017,data.gov.in,1,1,1.0,,True,1,,1851,4954
32,Daily data of Evapotranspiration of NRSC,Dataset,Daily Data of Evapo-transpiration,Central,"Department of Water Resources, River Development & Ganga Rejuvenation;Ministry of Jal Shakti;National Water Informatics Centre",4/10/2022,15/6/2025,4/10/2022,Ground Water,https://data.gov.in/files/ogdpv2dms/s3fs-public/datafile/Daily_data_of_Evapotranspiration_of_NRSC_Agency_during_August_2022.csv;1.0,https://api.data.gov.in/resource/98c433b1-9c86-40c7-baf4-d4eca5385698?api-key=579b464db66ec23bdd000001cdc3b564546246a772a26393094f5645&offset=0&limit=all&format=csv,text/csv,1846333.0,Monthly,Monthly,1,National Water Informatics Centre,,/resource/daily-data-evapotranspiration-nrsc,data.gov.in,5,1,,,True,0,7257813.0,1816,3394
33,"District wise, Disability wise, Age group wise , Gender wise Unique Disability ID (UDID) data as on 11.06.2024",Dataset,Unique Disability ID (UDID) ,Central,Ministry of Social Justice and Empowerment;Department of Empowerment of Persons with Disabilities,11/9/2023,11/6/2024,6/9/2023,Social Development;Social Development,https://data.gov.in/files/ogd20/ogdpv2dms/s3fs-public/UDIDDATA_0.csv;0.0,,application/vnd.ms-excel,3085379.0,Quarterly,Quarterly,1,Department of Empowerment of Persons with Disabilities,"Title of dataset: UDID Card data (www.swavlambancard.gov.in) updated: 11/06/2024.  Department:  (Department of Empowerment of Persons with Disabilities)  File formats Databases: .csv Format   Field Name: 1: State/UT Name(state_name), 2: District (district_name), 3: Disability Name (disability_type_name)  4: Age Group (age_group),    5: Gender: male_count (No of male Count in UDID), 6:Gender Female_count (No of Female Count in UDID), 7: Total Number (total_count)(Male Count ) + (Female count).                                                                                                                                         Department  will update data on quarterly basis. ",/resource/district-wise-disability-wise-age-group-wise-gender-wise-unique-disability-id-udid-data,data.gov.in,1,1,,,True,0,,1799,1603
34,All India Consumer Price Index (Rural/Urban) upto May 2023,Dataset,All India Consumer Price Index (Rural/Urban),Central,Ministry of Statistics and Programme Implementation,18/9/2023,18/9/2023,17/7/2023,Economy;Prices;Finance;Economy;Statistics,https://data.gov.in/files/ogd20/ogdpv2dms/s3fs-public/All_India_Index_Upto_April23.csv;0.0,,application/vnd.ms-excel,66022.0,Monthly,Monthly,1,Ministry of Statistics and Programme Implementation,,/resource/all-india-consumer-price-index-ruralurban-upto-may-2023,data.gov.in,1,1,,1.0,True,0,,1737,1934
35,"All India area weighted monthly, seasonal and annual rainfall (in mm) from 1901-2015",Dataset,Rainfall in India,Central,"Ministry of Earth Sciences;India Meteorological Department (IMD);India Meteorological Department (IMD), Pune",30/3/2017,10/12/2021,2/1/2017,Science and Technology;Atmospheric Science;Earth Sciences;Science and Technology;Atmospheric Science;Earth Sciences,https://data.gov.in/files/ogd20/ogdpv2dms/s3fs-public/datafile/rainfall_area-wt_India_1901-2015.csv,,text/csv,14160.0,Annual,Annual,0,"India Meteorological Department (IMD), Pune",Monthly rainfall series contains monthly rainfall data for the period 1901- 2012 from delayed mode computation using all available stations and 2013-2015 from real time data series; NA: Not Available,/resource/all-india-area-weighted-monthly-seasonal-and-annual-rainfall-mm-1901-2015,data.gov.in,1,1,1.0,,True,1,,1733,2023
36,Crime Head-wise Police Disposal of IPC Crime Cases during 2021,Dataset,Crime in India - 2021,Central,Ministry of Home Affairs;Department of States;National Crime Records Bureau (NCRB),18/10/2022,18/10/2022,17/10/2022,Police;Army,https://data.gov.in/files/ogd20/ogdpv2dms/s3fs-public/NCRB-2021_Table_17A.1.csv;0.0,,text/csv,18547.0,Annual,Annual,0,National Crime Records Bureau (NCRB),As per data provided by States/UTs,/resource/crime-head-wise-police-disposal-ipc-crime-cases-during-2021,data.gov.in,1,1,,1.0,True,0,0.0,1683,1629
37,"Foreign Tourist Arrivals (FTAs), Arrivals of Non-Resident Indians (NRIs) and International Tourist Arrival (ITAs) from 1981 to 2017",Dataset,India Tourism Statistics,Central,Ministry of Tourism,28/10/2022,28/10/2022,2/5/2019,Travel and Tourism,https://data.gov.in/files/ogdpv2dms/s3fs-public/datafile/Tourism_In_India_Statistics_2018-Table_2.1.1_1.csv;0.0,,text/csv,875.0,Annual,Annual,0,Ministry of Tourism,"Source: Bureau of Immigration, Govt. of India; NA: Not Available; Data for '2018' is provisional; Value of 'FTAs in India - Percentage change over previous year' for 2018 is Growth Rate over same period of previous year.
",/resource/foreign-tourist-arrivals-ftas-arrivals-non-resident-indians-nris-and-international-0,data.gov.in,1,0,0.0,5.0,True,0,,1673,1754
38,Enrolment by Age and Class (UDISE plus) during 2019-20,Dataset,Enrolment by Age and Class (UDISE plus),Central,Ministry of Education;Department of School Education and Literacy,13/1/2022,27/1/2022,13/1/2022,Education;Education,https://data.gov.in/files/ogd20/ogdpv2dms/s3fs-public/datafile/enrolment_age_2019_20.csv?VersionId=105166644598849;0.0,,text/csv,1543548.0,Annual,Annual,0,Department of School Education and Literacy,,/resource/enrolment-age-and-class-udise-plus-during-2019-20,data.gov.in,1,1,1.0,,True,1,,1656,1125
39,Year-wise retail inflation rate based on Consumer Price Index-Combined (CPI-C) from 2017-18 to 2022-23,Dataset,Answers Data of Rajya Sabha Questions for Session 259,Central,Rajya Sabha,30/5/2023,30/5/2023,29/5/2023,All;Finance,https://data.gov.in/files/ogd20/ogdpv2dms/s3fs-public/RS_Session_259_AU_3106.csv;0.0,,text/csv,137.0,Quarterly,Quarterly,0,Rajya Sabha,"Source - RAJYA SABHA SESSION - 259 UNSTARRED QUESTION No 3106. ANSWERED ON, 28TH MARCH 2023. Data Figures are in Percentage. FY 2022-23 (April-February). Source - MOSPI. Note - Data for February 2023 is provisional.",/resource/year-wise-retail-inflation-rate-based-consumer-price-index-combined-cpi-c-2017-18-2022-23,data.gov.in,1,1,1.0,,True,0,0.0,1643,3102
40,GSVA by Economic Activity at Current Prices for Tamil Nadu from 2011-12 to 2016-17 (as on 31.03.2017),Dataset,Gross State Domestic Product at Current Prices,Central,Ministry of Statistics and Programme Implementation,1/8/2017,1/8/2017,18/7/2017,Finance;Economy;Statistics,https://data.gov.in/files/ogd20/ogdpv2dms/s3fs-public/dataurl18072017/NAD-Tamil_Nadu-GSVA_cur_2016-17.csv,http://data.gov.in/sites/default/files/dataurl18072017/NAD-Tamil_Nadu-GSVA_cur_2016-17.csv,text/csv,2564.0,Annual,Annual,0,Ministry of Statistics and Programme Implementation,Data values are Rs. in lakh.,/resource/gsva-economic-activity-current-prices-tamil-nadu-2011-12-2016-17-31032017,data.gov.in,1,1,0.0,,True,1,,1639,1771
41,District-wise Demographic Data of Unorganised Workers registered on eShram as on Previous Day,Dataset,Demographic Data of Unorganised Workers registered on eShram portal,Central,Ministry of Labour and Employment,21/12/2023,27/6/2025,19/12/2023,Unorganized Sector Workers;Labour and Employment,https://data.gov.in/files/ogdpv2dms/s3fs-public/eshram_sample_0.csv;1.0,,text/csv,51573.0,Daily,Daily,1,Ministry of Labour and Employment,The data is based on self declaration.,/resource/district-wise-demographic-data-unorganised-workers-registered-eshram-previous-day,data.gov.in,5,1,,,True,1,7844104.0,1553,595880
42,Monthly Crude Oil Processed by Refineries,Dataset,Crude Oil Processed by Refineries,Central,Ministry of Petroleum and Natural Gas;Petroleum Planning & Analysis Cell (PPAC),14/6/2023,27/6/2025,13/6/2023,Non Renewable;Non Renewable,https://data.gov.in/files/ogdpv2dms/s3fs-public/CrudeOilProcessing.csv;1.0,https://api.data.gov.in/resource/8d3b6596-b09e-4077-aebf-425193185a5b?api-key=579b464db66ec23bdd000001cdc3b564546246a772a26393094f5645&offset=0&limit=all&format=csv,text/csv,41184.0,Monthly,Monthly,1,Petroleum Planning & Analysis Cell (PPAC),"Source: Oil Companies, Some of the data may be provisional. For reference / details, please visit PPAC website (https://ppac.gov.in/)",/resource/monthly-crude-oil-processed-refineries,data.gov.in,4,1,,,True,0,7526649.0,1541,2299
43,Statistics of Road Accidents in India From 2013 to 2016,Dataset,State/UT wise total no of road accidents,Central,Ministry of Road Transport and Highways,14/12/2017,14/2/2025,13/12/2017,Transport;Road Transport;Transport;Road Transport;Transport;Road Transport;Transport;Road Transport;Transport;Road Transport,https://data.gov.in/files/ogdpv2dms/s3fs-public/datafile/stat-road-ac-2013-2016.csv;0.0,,text/csv,4783.0,Annual,Annual,0,Ministry of Road Transport and Highways,NA: Not Available,/resource/statistics-road-accidents-india-2013-2016,data.gov.in,1,1,1.0,,True,1,,1480,11011
44,CBSE Result Statistics Class XII - 2023,Dataset,CBSE Result Statistics Class XII,Central,Ministry of Education;Department of School Education and Literacy;Central Board of Secondary Education (CBSE),13/6/2023,13/6/2023,13/6/2023,Education,https://data.gov.in/files/ogd20/ogdpv2dms/s3fs-public/class12-2023.csv;0.0,,text/csv,1625.0,Annual,Annual,0,Central Board of Secondary Education (CBSE),"Regd.: Registered. Appd.: Appeared, CTSA: Central Tibetan School Administration. JNV: Jawahar Navodaya Vidyalaya. KV: Kendriya Vidyalaya. Data figures are in numbers.",/resource/cbse-result-statistics-class-xii-2023,data.gov.in,1,1,,,True,0,,1449,565
45,"District-wise availability of health centres in India as on 31st March, 2017",Dataset,Rural Health Statistics - 2017,Central,Ministry of Health and Family Welfare;Department of Health and Family Welfare,4/4/2018,12/2/2025,4/4/2018,Health and Family welfare;Family Welfare;Health;Health and Family welfare;Health;Health and Family welfare;Health;Health and Family welfare;Health;Health and Family welfare;Health;Health and Family welfare;Health;Health and Family welfare;Health;Health and Family welfare;Health;Health and Family welfare;Health;Health and Family welfare;Health;Health and Family welfare;Health,https://data.gov.in/files/ogdpv2dms/s3fs-public/datafile/District-wise_Health_Care_Infrastructure-2017_1.csv;0.0,,text/csv,27285.0,Annual,Annual,0,Department of Health and Family Welfare,"For Arunachal Pradesh, Out of 588  total 312 Sub Centres are functional in the State; For Tamil Nadu, Out of Total 1835 PHCs 1362 PHCs are functioning in Rural areas, while 473 are in urban areas;  Old name of district Gurugram was Gurgaon;  Old name of district Nuh was Mewat; NA: Not Available",/resource/district-wise-availability-health-centres-india-31st-march-2017,data.gov.in,1,1,1.0,,True,1,,1444,2891
46,"Area weighted monthly, seasonal and annual rainfall ( in mm) for 36 meteorological subdivisions from 1901-2015",Dataset,Rainfall in India,Central,"Ministry of Earth Sciences;India Meteorological Department (IMD);India Meteorological Department (IMD), Pune",30/3/2017,10/12/2021,2/1/2017,Science and Technology;Atmospheric Science;Earth Sciences;Science and Technology;Atmospheric Science;Earth Sciences,https://data.gov.in/files/ogd20/ogdpv2dms/s3fs-public/datafile/rainfall_area-wt_sd_1901-2015.csv,,text/csv,528115.0,Annual,Annual,0,"India Meteorological Department (IMD), Pune",Monthly rainfall series contains monthly rainfall data for the period 1901- 2012 from delayed mode computation using all available stations and 2013-2015 from real time data series; NA: Not Available,/resource/area-weighted-monthly-seasonal-and-annual-rainfall-mm-36-meteorological-subdivisions-1901,data.gov.in,1,1,1.0,,True,1,,1380,1782
47,Monthly mean maximum & minimum temperature and total rainfall based upon 1901-2000 data,Dataset,Climatology data of Important Cities,Central,"Ministry of Earth Sciences;India Meteorological Department (IMD);India Meteorological Department (IMD), Pune",30/9/2016,10/12/2021,26/10/2015,Science and Technology;Earth Sciences;Science and Technology;Earth Sciences,https://data.gov.in/files/ogd20/ogdpv2dms/s3fs-public/datafile/climate_change_upto_2000_1.csv,,text/csv,62833.0,Annual,Annual,0,"India Meteorological Department (IMD), Pune",,/resource/monthly-mean-maximum-minimum-temperature-and-total-rainfall-based-upon-1901-2000-data-3,data.gov.in,1,1,1.0,1.0,True,1,,1320,5345
48,Monthly Consumption of Petroleum Products,Dataset,Consumption of Petroleum Products,Central,Ministry of Petroleum and Natural Gas;Petroleum Planning & Analysis Cell (PPAC),19/5/2023,27/6/2025,19/5/2023,Power and Energy,https://data.gov.in/files/ogd20/ogdpv2dms/s3fs-public/productconsumption.csv;1.0,,text/csv,23660.0,Daily,Monthly,1,Petroleum Planning & Analysis Cell (PPAC),"i) Part of the data may be provisional. For details kindly refer to PPAC website ( https://ppac.gov.in )ii) The source of information includes Oil Companies, DGCIS & online SEZ data.",/resource/monthly-consumption-petroleum-products,data.gov.in,1,1,,,True,0,7492382.0,1264,1010
49,"State-wise Population, Decadal Population Growth Rate and Population Density - 2011",Dataset,Rural Health Statistics - 2015,Central,Ministry of Health and Family Welfare;Department of Health and Family Welfare,13/7/2016,10/12/2021,12/7/2016,Health and Family welfare;Family Welfare;Health;Health and Family welfare;Family Welfare;Health,https://data.gov.in/files/ogd20/ogdpv2dms/s3fs-public/dataurl12072016/RHS_2015_ch-1_table_2a.csv,http://data.gov.in/sites/default/files/dataurl12072016/RHS_2015_ch-1_table_2a.csv,text/csv,1322.0,Annual,Annual,0,Department of Health and Family Welfare,"For Manipur: Updated population of Manipur as per the order (9/25/2013-CD(Cen.) dtd 07-01-2014) of RGI; For Andhra Pradesh and Telangana: Data collected from the States; NA: Not Available; Source: Population Census of India, Office of the Registrar General & Census Commissioner, India",/resource/state-wise-population-decadal-population-growth-rate-and-population-density-2011,data.gov.in,1,1,0.0,,True,1,,1261,747
50,District Wise Total  MSME Registered Manufacturing Enterprises till last date,Dataset,Udyog Aadhaar Memorandum  ( MSME Registration ),Central,"Ministry of Micro, Small and Medium Enterprises",24/7/2019,7/8/2019,23/7/2019,Medium;Micro;Small Scale;Medium;Micro;Small Scale,https://data.gov.in/files/ogdpv2dms/s3fs-public/datafile/uam_msme_total_manufacturing_unit.csv;1.0,,text/csv,55955.0,One-time,Daily,0,"Ministry of Micro, Small and Medium Enterprises",,/resource/district-wise-total-msme-registered-manufacturing-enterprises-till-last-date,data.gov.in,1,1,1.0,,True,1,6667162.0,1250,2092
51,District-wise MGNREGA Data at a Glance ,Dataset,Mahatma Gandhi National Rural Employment Guarantee Act (MGNREGA),Central,Ministry of Rural Development;Department of Rural Development (DRD),13/9/2023,27/6/2025,11/9/2023,Development;Development,https://data.gov.in/files/ogd20/ogdpv2dms/s3fs-public/NREGA.csv;1.0,https://api.data.gov.in/resource/ee03643a-ee4c-48c2-ac30-9f2ff26ab722?api-key=579b464db66ec23bdd000001cdc3b564546246a772a26393094f5645&offset=0&limit=all,text/csv,153388.0,Daily,Daily,1,Department of Rural Development (DRD),,/resource/district-wise-mgnrega-data-glance,data.gov.in,5,1,,1.0,True,1,603001422.0,1235,1748
52,District Level Manufacturing MSME Registered Enterprises under UDYAM Registration till last date,Dataset, UDYAM Registration (MSME Registration),Central,"Ministry of Micro, Small and Medium Enterprises",1/11/2021,27/6/2025,26/10/2021,Industries;Medium;Micro;Small Scale;Medium;Micro;Small Scale;Medium;Micro;Small Scale;Medium;Micro;Small Scale;Medium;Micro;Small Scale;Medium;Micro;Small Scale,https://data.gov.in/files/ogd20/ogdpv2dms/s3fs-public/datafile/district_level_manufacturing_msme.csv?VersionId=105172500356481;1.0,https://api.data.gov.in/resource/ae789703-638a-4942-b79e-17868103dec8?api-key=579b464db66ec23bdd000001cdc3b564546246a772a26393094f5645&offset=0&limit=all&format=csv,text/csv,37346.0,Daily,Daily,1,"Ministry of Micro, Small and Medium Enterprises",,/resource/district-level-manufacturing-msme-registered-enterprises-under-udyam-registration-till,data.gov.in,4,1,1.0,11.0,True,0,7159068.0,1181,835
53,Indian Sign Language Dictionary till January 2024,Dataset,Indian Sign Language Dictionary,Central,Ministry of Social Justice and Empowerment;Department of Empowerment of Persons with Disabilities,7/2/2024,18/2/2025,6/2/2024,Disabled;Disabled,https://data.gov.in/files/ogdpv2dms/s3fs-public/ISL_Dictionary_words.csv;0.0,,application/vnd.ms-excel,2661.0,Annual,Annual,0,Department of Empowerment of Persons with Disabilities,,/resource/indian-sign-language-dictionary-till-january-2024,data.gov.in,1,0,,73.0,True,0,,1163,680
54,"Percentage of households having electricity, Improved source of drinking water, Having access to improved toilet facility, Use clean fuel for cooking - DLHS IV",Dataset,District Level Household and Facility Survey (DLHS-4),Central,Ministry of Health and Family Welfare;Department of Health and Family Welfare,29/12/2014,9/12/2021,24/12/2014,Health and Family welfare;Family Welfare;Health;Health and Family welfare;Family Welfare;Health,https://data.gov.in/files/ogdpv2dms/s3fs-public/Percentage_of_households_DLHS4.csv,https://data.gov.in/sites/default/files/Percentage_of_households_DLHS4.csv,text/csv,12256.0,Others,Annual,0,Department of Health and Family Welfare,NA :Percentage not shown for below 20 cases; The data of 21 states have been provided,/resource/percentage-households-having-electricity-improved-source-drinking-water-having-access,data.gov.in,1,1,0.0,,True,1,,1144,498
55,"District Rainfall Normal (in mm) Monthly, Seasonal And Annual : Data Period 1951-2000",Dataset,"District Rainfall Normal (in mm) Monthly, Seasonal And Annual : Data Period 1951-2000",Central,Ministry of Earth Sciences;India Meteorological Department (IMD),31/5/2013,17/4/2014,31/5/2013,Science and Technology;Atmospheric Science;Science and Technology;Atmospheric Science,https://data.gov.in/files/ogd20/ogdpv2dms/s3fs-public/datafile/District_Rainfall_Normal_0.xls,,application/vnd.ms-excel,167936.0,One-time,Monthly,0,India Meteorological Department (IMD),,/resource/district-rainfall-normal-mm-monthly-seasonal-and-annual-data-period-1951-2000,data.gov.in,1,1,1.0,,True,1,,1141,6634
56,Location wise daily Ambient Air Quality of Tamil Nadu for the year 2014,Dataset,Historical Daily Ambient Air Quality Data,Central,"Ministry of Environment, Forest and Climate Change;Central Pollution Control Board",17/10/2016,10/12/2021,6/10/2016,Environment and Forest;Industrial Air Pollution;Residential Air Pollution;Vehicular Air Pollution;Environment and Forest;Industrial Air Pollution;Residential Air Pollution;Vehicular Air Pollution,https://data.gov.in/files/ogd20/ogdpv2dms/s3fs-public/dataurl06102016/cpcb_dly_aq_tamil_nadu-2014.csv,http://data.gov.in/sites/default/files/dataurl06102016/cpcb_dly_aq_tamil_nadu-2014.csv,text/csv,433708.0,Annual,Daily,0,Central Pollution Control Board,"Data has been collected from the field instruments, It is likely that the data may display some errors or abnormal values. Any abnormal value may be due to any episode or instrumental error at any particular time; NA: Not Available/Not Applicable; Figures are in micrograms (one-millionth of a gram) per cubic meter.",/resource/location-wise-daily-ambient-air-quality-tamil-nadu-year-2014,data.gov.in,1,1,0.0,,True,1,,1081,198
57,"District wise Number of Poultry Farms and Poultry Birds in Farms, 2007  - Tamil Nadu",Dataset,Details of Poultry Farms and Poultry Birds in Farms,Central,"Department of Animal Husbandry and Dairying;Ministry of Fisheries, Animal Husbandry and Dairying",12/11/2015,12/11/2015,3/11/2015,Agriculture;Animal Husbandry;Agriculture;Animal Husbandry,https://data.gov.in/files/ogd20/ogdpv2dms/s3fs-public/datafile/Tamilnadu-Table-12_33_liv_stk_cns_2007_1.csv,http://data.gov.in/sites/default/files/dataurl02112015/TamilNadu-Table12_33_liv_stk_cns_2007.csv,text/csv,4951.0,Five Yearly,Five Yearly,0,"Ministry of Fisheries, Animal Husbandry and Dairying",18th Livestock census. All values are in number.,/resource/district-wise-number-poultry-farms-and-poultry-birds-farms-2007-tamil-nadu,data.gov.in,1,1,1.0,,True,1,,1018,1158
58,"Longitudinal Ageing Study in India (LASI), Wave  I, 2017-18",Dataset,Longitudinal Ageing Study in India (LASI),Central,Ministry of Health and Family Welfare;Department of Health and Family Welfare;International Institute for Population Sciences (IIPS),26/8/2022,26/8/2022,10/5/2022,Health and Family welfare;Health;Health,https://data.gov.in/files/ogd20/ogdpv2dms/s3fs-public/LASI_India_State_UT_Factsheet-Final%20Checked%2023.08.22.xls;0.0,,application/vnd.ms-excel,107520.0,Others,Others,1,International Institute for Population Sciences (IIPS),"* Including spouse irrespective of age, - indicates less number of cases/ no cases.This factsheet data is based on LASI state factsheets. This information is based on LASI eligible respondents (45+) ** Sikkim state data collection was carried out in 2020-21, this factsheet was release in 2022.While preparing this datasheet, two indicators from India factsheet - 167 & 168 are omitted to match with state/Uts factsheet indicators for detailed footnote refer to https://www.iipsindia.ac.in/sites/default/files/LASI_India_Factsheet.pdfhttps://www.iipsindia.ac.in/sites/default/files/other_files/LASI-Compendium_of_Factsheets%20_All_States_%26_UTs1.pdf",/resource/longitudinal-ageing-study-india-lasi-wave-i-2017-18,data.gov.in,1,0,,3.0,True,0,,972,436
59,State Level Consumer Price Index (Rural/Urban)  upto November 2021,Dataset,State Level Consumer Price Index (Rural/Urban),Central,Ministry of Statistics and Programme Implementation,25/1/2022,27/1/2022,17/1/2022,Economy;Prices;Finance;Economy;Statistics,https://data.gov.in/files/ogd20/ogdpv2dms/s3fs-public/datafile/Statewise_General_Index_july2019_20Aug2020_dec20_2_2.csv?VersionId=105166644746369;0.0,,text/csv,81597.0,Monthly,Monthly,0,Ministry of Statistics and Programme Implementation,,/resource/state-level-consumer-price-index-ruralurban-upto-november-2021,data.gov.in,1,1,1.0,1.0,True,0,,937,1941
