92,Digital Seismotectonic Atlas of India and its Environs,Dataset,Digital Seismotectonic Atlas of India and its Environs,Central,Ministry of Mines;Geological Survey of India,8/8/2013,12/8/2021,8/8/2013,Mining;Others;Mining;Others,0.0,https://bhukosh.gsi.gov.in/arcgis/services/Seismotectonic/Seismotectonic/MapServer/WMSServer?request=GetCapabilities&service=WMS,WMS,163.0,One-time,One-time,0,Geological Survey of India,Seismotectonic Atlas of India and its Environs on scale 1:1 million published in 2000,/resource/digital-seismotectonic-atlas-india-and-its-environs,data.gov.in,2,0,0.0,59.0,False,1,,676,1553
93,Number of Newly Registered Motor Vehicles in 2009-10 and 2010-11 and Number of Registered Motor Vehicles as on 31st March 2010 and as on 31st March 2011 in Uttar Pradesh,Dataset,Number of Newly Registered Motor Vehicles and Number of Registered Motor Vehicles in Uttar Pradesh,Central,Ministry of Road Transport and Highways,8/5/2014,1/9/2016,28/4/2014,Transport;Road Transport;Transport;Road Transport,https://data.gov.in/files/ogd20/ogdpv2dms/s3fs-public/datafile/2.3.27_Uttarpradesh_rtyb_2010_11_1.csv,,text/csv,2516.0,Annual,Annual,0,Ministry of Road Transport and Highways,All figures are in numbers; Source: Offices of State Transport Commissioners/UT Administrations; NA-Not Reported; The data has been sourced from Road Transport Year Book-2009-10 & 2010-11.,/resource/number-newly-registered-motor-vehicles-2009-10-and-2010-11-and-number-registered-motor-25,data.gov.in,1,1,1.0,,True,1,,675,305
94,"Quarterly Estimates of GDP at Current Prices, 2011-12 Series From 2011-12 to 2022-23",Dataset,Quarterly Estimates of GDP at Current Prices,Central,Ministry of Statistics and Programme Implementation,5/4/2022,2/6/2025,4/4/2022,Economy;Macro Economy;Finance;Economy;Macro Economy,https://data.gov.in/files/ogdpv2dms/s3fs-public/GDP_QE_Current_Prices_2011-12_Series.csv;0.0,,text/csv,20283.0,Quarterly,Quarterly,1,Ministry of Statistics and Programme Implementation,,/resource/quarterly-estimates-gdp-current-prices-2011-12-series-2011-12-2022-23,data.gov.in,1,1,,1.0,True,1,,670,817
95,Boundaries of Agro-climatic regions,Dataset,Boundaries of Region,Central,"Department of Water Resources, River Development & Ganga Rejuvenation;Ministry of Jal Shakti;National Water Informatics Centre",28/9/2022,28/9/2022,16/9/2022,Ground Water;Surface Water;Ground Water;Surface Water,0.0,https://data.gov.in/files/ogdpv2dms/s3fs-public/dataurl15092022/Agroclimatic_regions.zip,application/zip,,One-time,One-time,1,National Water Informatics Centre,"This zip contains the various formats i.e .shp, .shx,.dbf,.prj,.sbn, .cpg,.dbf, This zip contains all the information of all agro-climatic regions of entire country",/resource/boundaries-agro-climatic-regions,data.gov.in,2,0,,,True,0,,663,769
96,"State-wise Population, Decadal Population Growth rate and Population Density - 2011",Dataset,Rural Health Statistics - 2016,Central,Ministry of Health and Family Welfare;Department of Health and Family Welfare,28/3/2017,10/12/2021,10/2/2017,Health and Family welfare;Family Welfare;Health;Health and Family welfare;Family Welfare;Health,https://data.gov.in/files/ogd20/ogdpv2dms/s3fs-public/datafile/Table_2A_State_Uts.csv,,text/csv,1506.0,Annual,Annual,0,Department of Health and Family Welfare,"For Manipur: Updated population of Manipur as per the order (9/25/2013-CD(Cen.) dtd 07-01-2014) of RGI; For Andhra Pradesh and Telangana: Data collected from the states; Source: Population Census of india, 2011; office of Registrar General & Census Commissioner, India",/resource/state-wise-population-decadal-population-growth-rate-and-population-density-2011-0,data.gov.in,1,1,1.0,,True,1,,658,3956
97,"State-wise Details of the Infant Mortality Rate, Institutional Delivery and Prevalence of Under Weight Children under five years of Age (in Reply to Unstarred Question on 07 December, 2022)",Dataset,Answers Data of Rajya Sabha Questions for Session 258,Central,Rajya Sabha,19/5/2023,19/5/2023,17/5/2023,All;Social Development,https://data.gov.in/files/ogd20/ogdpv2dms/s3fs-public/RS_Session_258_AU_142_A_and_B.iii_.csv;0.0,,text/csv,745.0,Quarterly,Quarterly,0,Rajya Sabha,"Source - Rajya Sabha Session - 258 Unstarred Question No. 142 Answered on 07 December, 2022. NA - Not Available. Source - National Family Health Survey-5 (2019-21). Data of West Bengal for Infant Mortality Rate - ST is based on 250-499 unweighted person-years of exposure to the risk of death.",/resource/state-wise-details-infant-mortality-rate-institutional-delivery-and-prevalence-under,data.gov.in,1,1,,,True,0,0.0,657,2206
98,Sector wise Estimated Number of Workers under Fourth Round of Quarterly Employment Survey from Jan to March 2022,Dataset,Quarterly Employment Survey (QES),Central,Ministry of Labour and Employment,25/3/2023,18/2/2025,20/3/2023,Employment,https://data.gov.in/files/ogdpv2dms/s3fs-public/QES.csv;0.0,,text/csv,296.0,Quarterly,Quarterly,0,Ministry of Labour and Employment,,/resource/sector-wise-estimated-number-workers-under-fourth-round-quarterly-employment-survey-jan,data.gov.in,1,1,,3.0,True,0,,644,486
99,Shape file of reservoir,Dataset,Boundaries of Water Resources Projects,Central,"Department of Water Resources, River Development & Ganga Rejuvenation;Ministry of Jal Shakti;National Water Informatics Centre",28/9/2022,28/9/2022,16/9/2022,Ground Water;Surface Water;Ground Water;Surface Water,0.0,https://data.gov.in/files/ogdpv2dms/s3fs-public/dataurl15092022/Reservoir.zip,application/zip,,One-time,One-time,1,National Water Informatics Centre,"This zip contains the various formats i.e .shp, .shx,.dbf,.prj,.sbn, .cpg,.dbf. This zip contains the information of all major and minor reservoir of entire country. This is a point layer",/resource/shape-file-reservoir,data.gov.in,2,0,,,True,0,,640,568
