92,Digital Seismotectonic Atlas of India and its Environs,Digital Seismotectonic Atlas of India and its Environs,Geological Survey of India,Ministry of Mines;Geological Survey of India,Mining;Others;Mining;Others,Seismotectonic Atlas of India and its Environs on scale 1:1 million published in 2000,8/8/2013,12/8/2021,8/8/2013,Dataset,WMS,/resource/digital-seismotectonic-atlas-india-and-its-environs,https://bhukosh.gsi.gov.in/arcgis/services/Seismotectonic/Seismotectonic/MapServer/WMSServer?request=GetCapabilities&service=WMS,data.gov.in,One-time,One-time,0.0,Central,0,163.0,0.0,1553,676,59.0,False,1,,2,0
93,Number of Newly Registered Motor Vehicles in 2009-10 and 2010-11 and Number of Registered Motor Vehicles as on 31st March 2010 and as on 31st March 2011 in Uttar Pradesh,Number of Newly Registered Motor Vehicles and Number of Registered Motor Vehicles in Uttar Pradesh,Ministry of Road Transport and Highways,Ministry of Road Transport and Highways,Transport;Road Transport;Transport;Road Transport,All figures are in numbers; Source: Offices of State Transport Commissioners/UT Administrations; NA-Not Reported; The data has been sourced from Road Transport Year Book-2009-10 & 2010-11.,8/5/2014,1/9/2016,28/4/2014,Dataset,text/csv,/resource/number-newly-registered-motor-vehicles-2009-10-and-2010-11-and-number-registered-motor-25,,data.gov.in,Annual,Annual,https://data.gov.in/files/ogd20/ogdpv2dms/s3fs-public/datafile/2.3.27_Uttarpradesh_rtyb_2010_11_1.csv,Central,0,2516.0,1.0,305,675,,True,1,,1,1
94,"Quarterly Estimates of GDP at Current Prices, 2011-12 Series From 2011-12 to 2022-23",Quarterly Estimates of GDP at Current Prices,Ministry of Statistics and Programme Implementation,Ministry of Statistics and Programme Implementation,Economy;Macro Economy;Finance;Economy;Macro Economy,,5/4/2022,2/6/2025,4/4/2022,Dataset,text/csv,/resource/quarterly-estimates-gdp-current-prices-2011-12-series-2011-12-2022-23,,data.gov.in,Quarterly,Quarterly,https://data.gov.in/files/ogdpv2dms/s3fs-public/GDP_QE_Current_Prices_2011-12_Series.csv;0.0,Central,1,20283.0,,817,670,1.0,True,1,,1,1
95,Boundaries of Agro-climatic regions,Boundaries of Region,National Water Informatics Centre,"Department of Water Resources, River Development & Ganga Rejuvenation;Ministry of Jal Shakti;National Water Informatics Centre",Ground Water;Surface Water;Ground Water;Surface Water,"This zip contains the various formats i.e .shp, .shx,.dbf,.prj,.sbn, .cpg,.dbf, This zip contains all the information of all agro-climatic regions of entire country",28/9/2022,28/9/2022,16/9/2022,Dataset,application/zip,/resource/boundaries-agro-climatic-regions,https://data.gov.in/files/ogdpv2dms/s3fs-public/dataurl15092022/Agroclimatic_regions.zip,data.gov.in,One-time,One-time,0.0,Central,1,,,769,663,,True,0,,2,0
96,"State-wise Population, Decadal Population Growth rate and Population Density - 2011",Rural Health Statistics - 2016,Department of Health and Family Welfare,Ministry of Health and Family Welfare;Department of Health and Family Welfare,Health and Family welfare;Family Welfare;Health;Health and Family welfare;Family Welfare;Health,"For Manipur: Updated population of Manipur as per the order (9/25/2013-CD(Cen.) dtd 07-01-2014) of RGI; For Andhra Pradesh and Telangana: Data collected from the states; Source: Population Census of india, 2011; office of Registrar General & Census Commissioner, India",28/3/2017,10/12/2021,10/2/2017,Dataset,text/csv,/resource/state-wise-population-decadal-population-growth-rate-and-population-density-2011-0,,data.gov.in,Annual,Annual,https://data.gov.in/files/ogd20/ogdpv2dms/s3fs-public/datafile/Table_2A_State_Uts.csv,Central,0,1506.0,1.0,3956,658,,True,1,,1,1
97,"State-wise Details of the Infant Mortality Rate, Institutional Delivery and Prevalence of Under Weight Children under five years of Age (in Reply to Unstarred Question on 07 December, 2022)",Answers Data of Rajya Sabha Questions for Session 258,Rajya Sabha,Rajya Sabha,All;Social Development,"Source - Rajya Sabha Session - 258 Unstarred Question No. 142 Answered on 07 December, 2022. NA - Not Available. Source - National Family Health Survey-5 (2019-21). Data of West Bengal for Infant Mortality Rate - ST is based on 250-499 unweighted person-years of exposure to the risk of death.",19/5/2023,19/5/2023,17/5/2023,Dataset,text/csv,/resource/state-wise-details-infant-mortality-rate-institutional-delivery-and-prevalence-under,,data.gov.in,Quarterly,Quarterly,https://data.gov.in/files/ogd20/ogdpv2dms/s3fs-public/RS_Session_258_AU_142_A_and_B.iii_.csv;0.0,Central,0,745.0,,2206,657,,True,0,0.0,1,1
98,Sector wise Estimated Number of Workers under Fourth Round of Quarterly Employment Survey from Jan to March 2022,Quarterly Employment Survey (QES),Ministry of Labour and Employment,Ministry of Labour and Employment,Employment,,25/3/2023,18/2/2025,20/3/2023,Dataset,text/csv,/resource/sector-wise-estimated-number-workers-under-fourth-round-quarterly-employment-survey-jan,,data.gov.in,Quarterly,Quarterly,https://data.gov.in/files/ogdpv2dms/s3fs-public/QES.csv;0.0,Central,0,296.0,,486,644,3.0,True,0,,1,1
99,Shape file of reservoir,Boundaries of Water Resources Projects,National Water Informatics Centre,"Department of Water Resources, River Development & Ganga Rejuvenation;Ministry of Jal Shakti;National Water Informatics Centre",Ground Water;Surface Water;Ground Water;Surface Water,"This zip contains the various formats i.e .shp, .shx,.dbf,.prj,.sbn, .cpg,.dbf. This zip contains the information of all major and minor reservoir of entire country. This is a point layer",28/9/2022,28/9/2022,16/9/2022,Dataset,application/zip,/resource/shape-file-reservoir,https://data.gov.in/files/ogdpv2dms/s3fs-public/dataurl15092022/Reservoir.zip,data.gov.in,One-time,One-time,0.0,Central,1,,,568,640,,True,0,,2,0
